__label__negative, みんな の 手本 で ある からには ネガティブ で あっ て は いけ ない ん だ 
__label__negative, どの 職場 に も ネガティブ な 人 が 何人 か 働い て いる だ から あなた も 時には これら の 人たち と 接触 し いっしょ に 働か なけれ ば なら ない しかし わざわざ 破滅 の 預言者 たち と 一緒 に 過ごす よう な こと を し て は いけ ない 
__label__negative, ポジティブ な 人 に 近づき ネガティブ な 人 から 離れる 
__label__negative, おなか が すい て くる と 人間 ネガティブ に なる ん だ よ 
__label__negative, 人間 の 心 は 放っ て おく と 九 割 は 否定的 方向 に 傾い て しまい ます だ から 常に 肯定的思考 を 身 に つけ なけれ ば なり ませ ん 
__label__negative, 何事 につけ 世間 で は 積極 は 良し と さ れ 消極 は 否定的 に 見 られる だ が 点数 や 売上 の よう な 表面 的 な 物差し の 中身 を 直視 せ ず 無理 を 重ね 重ね させ て 壊れ て しまっ た 子供 や 大人 破綻 し た 企業 は 少なく ない 
__label__negative, 破壊 的 否定 的 な こと に 神経 を 費やす の は 潜在意識 に 毒 を 与える よう な もの です そういう 人 が 幸せ に なれる わけ が あり ませ ん 
__label__negative, あなた の 成功 を 妨げる の は あなた 自身 です あなた の 心 が マイナス に 働い た とき 否定的 あるいは 破壊 的 に 働い た とき に あなた は 最大 の 障害 に 直面 する こと に なる の です 
__label__negative, いつも クヨクヨ 悩ん で いる 人 は 悩み の 種 が 尽き ない から 悩ん で いる の で は ありません 心 が 不安定 だ から どんな 問題 で も 否定的 で 不安 な 状態 に 見え て しまう の です 一刻 も 早く この 悪循環 を 断ち切る 必要 が あり ます 
__label__negative, すべて 人生 は 心 に 描い た 通り に なる どの よう な 厳しい 状況 に 置か れよ う と 否定 的 な こと を 心 に 浮かべる べき で は ない まじめ に 前向き に 努力 し て いけ ば 決して 悪い こと が あろう はず が ない と 確信 し て 常に 堂々 と 明るく 進ま なけれ ば なら ない 
__label__negative, どんな 仕事 に 取り組む とき でも 忘れ て は いけ ない こと が あり ます それ は 自分 の 仕事 について いささか も 否定 的 な 見解 を 抱い て は いけ ない という こと です もし どう 冷静 に 考え て も それ が でき ない と し たら その 仕事 を あきらめ なさい 
__label__negative, 自殺 を 想う こと は 強い 慰謝 剤 で ある これ によって 数々 の 悪 夜 が 楽 に 過ごせる 
__label__negative, 多数 という もの より しゃくにさわる もの は ない なぜなら 多数 を 構成 し て いる もの は 少数 の 有力 な 先進 者 の ほか に は 大勢 順応 の ならず者 と 同化 さ れる 弱者 と 自分 の 欲する こと さえ 全然 わから ない で くっつい て 来る 大衆 と である から 
__label__negative, 人生 という の は 矛盾 から 成り立っ て いる もの な ん だ もしも 矛盾 の 中心 に ちゃんと 止まる もの なら 人生 の 意味 が 分かる はず だ 
__label__negative, 人生 に は ただ 三つ の 事件 しか ない 生まれる こと 生きる こと 死ぬ こと で ある 生ま れる とき は 気がつか ない 死ぬ とき は 苦しむ そして 生き て いる とき は 忘れ て いる 
__label__negative, 生きる 理由 は ない が また 死ぬ 理由 も ない 人生 へ の 軽蔑 を 示す べく 我々 に 残さ れ た 唯一 の 方法 は それ を 受け入れる こと で ある 人生 は 苦労 し て 捨てる ほど の 価値 も ない 
__label__negative, 人生 は 何事 も なさ ぬ に は あまりに も 長い が 何事 か を なす に は あまりに も 短い 
__label__negative, 智に働けば角が立つ 情 に 棹 せ ば 流さ れる 意地 を 通せ ば 窮屈 だ 兎角 に この世 は 住み にくい 
__label__negative, 人生 は ただ 歩き回る 影法師 哀れ な 役者 だ 出場 の 時 だけ 舞台 の 上 で 見栄 を きっ たり わめい たり そして あと は 消え て なくなる 
__label__negative, 笑わ れ て 笑わ れ て 強く なる 
__label__negative, 花に嵐 の たとえ も ある さ さよなら だけ が 人生 だ 
__label__negative, じゃ これ が 地獄 な の か こう だ と は 思わ なかっ た 二人 と も おぼえ て いる だろ う 硫黄 の 匂い 火あぶり 台 焼き網 なんか 要る もの か 地獄 と は 他人 の こと だ 
__label__negative, 私 は あなた の 肉体 を 考える の が 怖し い あなたに 肉体 が なけれ ば よい と 思わ れ て 仕方がない 私 の 肉体 も 忘れ て 欲しい そして もう 私 は あなたに 二 度 と 会い たく ない 誰 と で も 結婚 し て 下さい 私 は あなた に 疲れ た 私 は 私 の 中 で 別 の あなた を 育てる から 
__label__negative, こんなに 一生懸命 し て いる の に 報わ れ ない 当たり前 です 人生 と は その 労力 に 比例 し て 報わ れ ない こと が 自然 だ から です こんな に 訴え て いる の に わかっ て もらえ ない 当たり前 です 人生 と は どんなに 訴え て も わかっ て もらえ ない の が 自然 だ から です 
__label__negative, 良き 友 良き 本 眠り かけ た 良心 これぞ 理想 の 人生 
__label__negative, ある 一人 の 人間 が 成功 する と 世間 の 人達 という の は よっ て たかっ て 足 を ひっぱっ て 失脚 さ せよ う と する が いったん 落ちぶれ た と なる と 助けよ う と する もの で ある 
__label__negative, たいがい の 人間 は 一生懸命 に 働く の が 好き で ある とくに 給料 を 払う 側 の とき に は 
__label__negative, 友情 という の は 大きな 報酬 を 期待 し て 小さな サービス を する といった 一 種 の キブアンドテイク の 契約 で ある 
__label__negative, 人生 は 恐れ を 知ら ぬ 冒険 か 無 の どちら か である 
__label__negative, 人生 の 大きな 秘訣 は 決して 他人 の 邪魔 を し ない こと だ 
__label__negative, 自分 で 自分 の 価値 を 過大評価 しない よう に 
__label__negative, 人生 は タマネギ みたい な もの ひとつ 剥く たび とき に 泣け て くる の さ 
__label__negative, 我々 人間 は 泣き ながら 生まれ ぶつぶつ と 不平 を 言い ながら 生き そして それ から がっかり し て 死ん で ゆく の で ある 
__label__negative, 若い 頃 は 私 は お金 こそ が 人生 で 最も 大切 な もの だ と 思っ て い た 今 歳 を とっ て それ が 正しい こと を 知っ た 
__label__negative, 新しい 喜び は 新しい 苦痛 を もたらす 
__label__negative, 友愛 の 多く は 見せかけ 恋情 の 多く は 愚か さ である に すぎ ない 
__label__negative, 金 を 貸す と 金も 友達 も なくし て しまう 金 を 借りる と 倹約 の 心 が 鈍っ て しまう 
__label__negative, さらに 良く しよ う と し て 良い もの を 駄目 に し て しまう こと が 多い 
__label__negative, 弱虫 は 幸福 を さえ おそれる もの です 綿 で 怪我 を する ん です 幸福 に 傷つけ られる 事 も ある ん です 
__label__negative, 誰 ひとり 知る もの も い ない 人ごみ の 中 を かき分け て いく とき ほど 孤独 を 感ずる こと は ない 
__label__negative, 人間 は 自分 が 考える ほど 不幸 でも ない し それほど 幸福 で も ない 
__label__negative, 話 の 種 に なる より 悪い 事 が 一つ だけ ある 話 の 種 に も なら ない こと だ 
__label__negative, 人 が 私 に 同意 する 時 は いつ でも 自分 が 間違っ て いる よう な 気 が し て なら ない 
__label__negative, 富 は 海水 に 似 て いる 飲め ば 飲む ほど 渇く 名声 について も 同じ こと が 当てはまる 
__label__negative, 人間 は ちょっと 見る と 前 から 引か れ て いる よう だ が ほんとう は 後ろ から 押さ れ て いる の だ 
__label__negative, 幸福 とか 行い とか が いつかしら あっ た の か と 疑う 
__label__negative, 疑い へ 哲学 へ と 促さ れ 私たち は 到達 する 皮肉 の 第 一 段階 へ 
__label__negative, 幸福 を 追いかけ て いる 間 は おまえ は 幸福 で あり 得る だけ に 成熟 し て い ない 
__label__negative, 他人 の 悲劇 は 常に うんざり する ほど 月並み で ある 
__label__negative, 野望 と は 失敗 した 者 の 最後 の 逃げ場 所 で ある 
__label__negative, 関心 を 全然 もた ない ひと びと に は つねに 親切 で あり うる 
__label__negative, 結婚 と は まさしく 相互 の 誤解 に 基づく もの で ある 
__label__negative, 素顔 で 語る 時 人 は もっとも 本音 から 遠ざかる が 仮面 を 与えれ ば 真実 を 語り だす 
__label__negative, 人間 は みな 欲 の 病人 です 
__label__negative, 人間 の 本音 という の は 自分 の 願望 さえ 叶え ば どんな 残酷 な こと でも やってのける の です 
__label__negative, 世間 で いう 幸せ という の は ある 苦しみ が 一瞬 紛れ た 消え た よう に 見え た 状態 の こと を 言っ て いる の で あっ て 絶対 的 な 幸せ など という もの は どこ に も ない の です 
__label__negative, 人間関係 は なぜ これ ほど 難しい の か それ は 人間 に は もともと 社会性 が ない から です 
__label__negative, 人間 を 動かす つ の テコ は 恐怖 と 利益 で ある 
__label__negative, 頼る べき もの は 己 の 力 のみ 
__label__negative, 壮大 な 人物 は 耐え難い ほど 利己 的 で ある 
__label__negative, 年 を とっ た から 遊ば なく なる の で は なく 遊ば なく なる から 年 を とる の だ 
__label__negative, 青春 という の は 外部 は 輝い て いる が 内部 は 何 も 感じ られ ない 
__label__negative, 同情 さ れる と 自分 が 間違っ てる よう な 気 に なる 
__label__negative, 男 は 退屈 から 結婚 する 
__label__negative, 我々 は 幸福 に なる ため より も 他人 に 幸福 に 見せかける ため に 四苦八苦 し て いる 
__label__negative, 友情 の 多く は 見せかけ 恋 の 多く は 愚か さ で ある 
__label__negative, 皆 を 喜ばそ う として ごらん なさい 誰 も 喜ばす こと は でき ない でしょ う 
__label__negative, 人間 が 社交 する 理由 は 社交 を 愛し てる から では なく 孤独 が 恐ろしい から である 
__label__negative, 目的 の ない 生活 は 味気 なく 目的 の ある 生活 は 煩わしい 
__label__negative, 我々 が 誰か を 憎む とき 我々 は 彼 の 姿 を 借りて 自分 の 内部 に ある 何 か を 憎ん で いる の で ある 
