__label__negative, 完璧 に は 絶対 なれ ない のに なんで 完璧 って 言葉 が 出来 た の 
__label__negative, 人生 なんて 結局 『 誰か の 人生 』 で 全部 丸め込ま れる ん だ から どんなに 抗っ て も 死ぬ とき は 変わん ない よ だ から し たい こと いっぱい し て 死ん だら その 方 が 倍 価値 が ある よ 
__label__negative, 人 は 皆 一人 だ 皮肉 な こと に 唯一無二 で ある 決定的 証明 に なる 
__label__negative, 死ん だ 後 に は 何 も 残ら ない のに 僕たち は なぜ 生き 続けよ う と する の か 
__label__negative, 嘘つきは泥棒の始まり そんな こと は ない 自分 の 欲望 に 嘘 を つか ない から 物 を 盗む ん だ 逆説 的 に 嘘 が 正義 で ある こと を ここに 宣言 し たい 
__label__negative, 人類 は 幸福 を 当たり前 の よう に 受け取り 不幸 を いつまでも 根 に 持つ 罪深い 生き物 で ある 
__label__negative, 悲観主義 者 は あらゆる 機会 の 中 に 問題 を 見出す 楽観 主義者 は あらゆる 問題 の 中 に 機会 を 見出す 
__label__negative, 悲観主義 は 気分 による もの で あり 楽観 主義 は 意志 による もの で ある 
__label__negative, 男 が 家 から 一 歩 出る と 人 の 敵 が いる と 言う が それ は 嘘 だ 本当 の 敵 は 家 の 中 に いる 
__label__negative, 結婚 を しばしば 宝くじ に たとえる が それ は 誤り だ 宝くじ なら 当たる こと も ある の だ から 
__label__negative, 独身者 と は 妻 を 見つけ ない こと に 成功 し た 男 で ある 
__label__negative, 結婚 する と は 彼 の 権利 を 半分 に し て 義務 を 二倍 に する こと で ある 
__label__negative, 朝夕 の 食事 は うまから ず と も ほめ て 食う べし 
__label__negative, 女房 に 愛さ れる 技術 という もの は 発明 さ れ ない もの だろ う か 
__label__negative, 結婚 と は ただ 一人 の ため に 残り の 人々 を すべて 断念 せ ね ば なら ぬ 行為 で ある 
__label__negative, 結婚 する とき 私 は 女房 を 食べ て しまい たい ほど 可愛い と 思っ た 今 考える と あの とき 食べ て おけ ば よかっ た 
__label__negative, 妻 を 選ぶ の は ネクタイ を 買う の と よく 似 て いる 選ん だ 時 は 素敵 に 見える が 家 に 帰っ て 首 に 締め て みる と がっかり する 
__label__negative, 恋 は 人 を 盲目 に する が 結婚 は 視力 を 戻し て くれる 
__label__negative, できるだけ 早く 結婚 する こと は 女 の ビジネス で あり できるだけ 結婚しない で いる こと は 男 の ビジネス で ある 
__label__negative, 絶対 に マネ の でき ない マネ しよう と すら 思わ ない レベル の イノベーション を 続けろ 
__label__negative, 消費者 に 何 が 欲しい か を 聞い て それ を 与える だけ で は いけ ない 完成 する ころ に は 彼ら は 新しい もの を 欲し がる だろ う 
__label__negative, 約束 を 守る 最上 の 方法 は 　 決して 約束 し ない こと だ 
__label__negative, 壮大 な 人物 は 　 堪えがたい ほど 利己 的 で ある 
__label__negative, どんな 英雄 も 　 最後 に は 鼻 に つく 英雄 と なる 
__label__negative, 青春 という もの は 奇妙 な もの だ 　 外部 は 赤く 輝い て いる が 内部 で は 何 も 感じ られ ない の だ 
__label__negative, 友情 に は 絶えず 怠ら ぬ 繕い が 必要 で ある 
__label__negative, 幸福 は 夢に 過ぎ ず 苦労 は 現実 で ある 
__label__negative, 同情 さ れ た がる 渇望 は 自己陶酔 　 しかも 他人 の 懐 を 傷め て の 自己陶酔 の 渇望 で ある 
__label__negative, 人間 に は 　 裏切っ て やろ う と たくらん だ 裏切り より 心 弱 きが ゆえ の 裏切り の ほう が 多い の だ 
__label__negative, 我々 は 幸福 に なる ため により も 幸福 だ と 人 に 思わ せる ため に 四苦八苦 し て いる の で ある 
__label__negative, 目的 の ない 生活 は 味気 なく 目的 の ある 生活 は 煩わしい 
__label__negative, この世 に 必要 な 本 と は 自殺 の よう に ぼくら に 作用 する 本 の こと だ 
__label__negative, 人間 が 愛し合え ば ハッピーエンド は ありえ ない 
__label__negative, がんばっ てる 人 に は ゴメン と しか 言い よう が ない けど 努力 ってな ん か 下品 
__label__negative, ある 選択 を する という こと は その 選択 によって 生まれる はず の マイナス を すべて 背負う ぞ という こと 
__label__negative, 落とし穴 が ある 経験 は プラス に も なる が マイナス に なる こと も ある の だ 
__label__negative, ハンディキャップ を まったく 背負っ て ない 人 など い ない 誰 も が マイナス の 部分 を もっ て いる 自分 に 与え られ た マイナス を 背負い ながら 生き て いく こと それ が 人生 という もの で は ない か 
__label__negative, マイナス な 感情 を 持つ こと は 悪いこと の よう な 感覚 が 根付い て しまっ て い ます けれど 本来 感情 は コントロール 出来 ない もの 嫌い な 人 を 秒 で 好き に なれる か と 言っ たら 無理 です よ ね 緊張 し ない よう に と 思っ て も 緊張 は し て しまう もの 嫌い な もの は 嫌い で 緊張 も し て も いい ネガティブ な 感情 を 持っ て しまう 自分 を 否定 する の で は なく まず ちゃんと 向き合っ て ありのまま の 自分 に を あげる こと で 自己肯定感 を 持つ こと が 大事 
__label__negative, 女 の 人 が よく ない と 思う の は 男の子 が 何 か を がんばっ て 失敗 し た とき ほら ごらん なさい あの とき いっ た じゃ ない の って すぐ に 情熱的 に なる ところ 思い当たる でしょ う マイナス の 時 だけ 情熱的 に なる の は 女の子 の 卑し さ な の よ 
__label__negative, 自分 の 敵 は 自分 の マイナス の 想像力 
__label__negative, 初め に マイナス思考 で 最悪 の 結果 を 想定 し そう なら ない よう な 計画 を 立て て から 組織 や 集団 を 動かす そして 全体 の 流れ が 軌道 に 乗っ て き た と 見る や プラス思考 に 転じ て 攻め て 行く 
__label__negative, 遊ん だり 病気 を し たり ケンカ し たり 泣き 笑い 人生 の 思い出 の 積み重ね が 家族 を つくっ て いく の です プラス も マイナス も 全部 ひっくるめ て その 思い出 が 家族 な の です 血縁 で は ありません 
__label__negative, 時間 の 無駄遣い は 一種 の 自殺行為 で ある 
__label__negative, あなた の 言う こと は おそらく 正しい こと な の でしょ う しかし わたし の こと なら ば 放っ て おい て ください なぜ なら ば わたし は 必要 ある と 思っ た とき は 自ら 毒 杯 を あおる こと が でき ます から 
__label__negative, せめて 全能 の 神 が 自ら 命 を 絶つ こと を 禁じ て い なけれ ば 
__label__negative, 当の 受難 者 自身 によって なさ れ た 積極的 あるいは 消極的 行為 から 直接的 あるいは 間接 的 に 生ずる 一切 の 死 を 自殺 と 名づける 
__label__negative, 諦め は 日常 的 な 自殺 で ある 
__label__negative, いつまでも 人 を 恨ん で い て は なら ない 貴方 が 恨ん で いる 人 は 人生 を 楽しん で いる 
__label__negative, ありあまる ほど 自由 な 時間 の ある 人間 は たいてい 悪いこと を 考える もの で ある 
__label__negative, あまり 人 を 理解 できる と は 思わ ない わかる の は 好き か 嫌い か だけ だ 
__label__negative, あきらめ て しまう と 癒し よう の ない 不幸 も 和らげる 
__label__negative, 貴方 と 世の中 と の 戦い なら 世の中 の ほう に 賭け なさい 
__label__negative, 人 って 孤独 よね とか ネガティブ に 考え れる っていう の は 当たり前 じゃん ていう か そんな の 今更 認める とか そんな こと じゃ なく て そんな の 前提 で しか ない ん だ し それ を わかっ た 上 で の ポジティブ っていう の が 本当 の 強 さ だろ 
__label__negative, こいつ と いっしょ に 幸せになろう とか こいつ に 幸せ に し て もらお う と いう より も こいつ と だっ たら 不幸 に なっ て も 後悔 し ない という 相手 と めぐりあえ たら 最高 な ん じゃ ない か なぁ これ は 一見 ネガティブ な 考え に 思える かも しれ ない けど いちばん 強い 絆 な ん じゃ ない か な 
__label__negative, あきらめる という 言葉 から は ネガティブ な イメージ を 受け ます が あきらめる という スキル を 体得 する こと は とても 大切 な こと です 人 は ついつい いろいろ な もの が 欲しく なり ます が あまり 両手 に 抱え込み すぎる と 身動き が とれ なく なっ て しまい ます 
__label__negative, まだ 起き て い ない こと に ネガティブ な こと を 考える そういう 思考 が 働い て しまう まだ 起き て い ない こと に対して は 良い こと しか 考え ない 
__label__negative, 監督 は 孤独 を 愛さ ない と いけ ない し ストレス も 愛さ ない と いけ ない そんな ネガティブ な もの に対して お 友達 に なら ない と 駄目 な ん です 
__label__negative, 悪口 や 批判 など ネガティブ な 発言 は 控える べき です 話す 言葉 は その 人 自身 の 印象 に 直結 し ます ネガティブ な こと ばかり 言う 人 は 自分 も 相手 に マイナス の イメージ を 与え て しまう こと を 覚え て おき ましょ う 
__label__negative, 多く の 人 は うまく いか ない こと が ある と なんで 自分 だけ こんな について ないん だ と ネガティブ 思考 に 陥り ます が そもそも 人生 なんて 思う よう に なら ない の が 当たり前 もし とんとん拍子 に 物事 が 運ん だら 人間 は 必ず 傲慢 に なっ て 自信過剰 に なっ て しまう でしょ う 
__label__negative, 誰か が 失敗 する こと によって ほか の 人 の 発想 が 刺激 を 受ける そういう こと を 考えれ ば 失敗 を ネガティブ に 捉える 必要 は まったく ありません むしろ 失敗 を 恐れ たり 他人 の 失敗 を 非難 し たり する よう に なる と クリエイティブ の モチベーション が 一気に 下がる ので そちら の ほう を 注意 し て い ます 
__label__negative, 正直 に 告白 する 人 は ほとんど いない が 大きな 成功 を 収め た 人 の 中 に も 決して 褒め られ た もの で は ない ネガティブ な 悪 の 感情 を 原動力 に し た 人 が 少なく ない 成功 する ため の 方法 を 説い た 本 は 数 知れ ない が この 事実 を 指摘 し て いる もの は ない よう に 思う 大半 の 成功本 は ネガティブ な 感情 を 捨て すべて の 人 を 許し ポジティブ で 楽しい こと だけ を 考えよ と 説く こうした 教え は 一見 する と 正しい よう に 聞こえる が 現実 を 見る 限り それ は 大 嘘 だ 
__label__negative, 様々 な 分野 で 目 を 見張る よう な 成功 を 収め た 人 の 中 に は あいつ に 目 にも の 見せ て やる という 気持ち が 励み に なっ た と 打ち明ける 人 が 少なく ない 不安 や 恐怖心 に 突き 動かさ れ て 頑張る 人 も 多い なに を モチベーション の 材料 に する か について 他人 に とやかく 言わ れる 筋合い は ない その 人 によって それ が 有効 なら それで いい この よう な ネガティブ な 感情 が 好ましい 結果 を 生む 場合 が ある こと を 認め ない の は 甘い 考え だ と 言わ ざる を 得 ない 
__label__negative, ネガティブ な 感情 は 自分 の 課題 を 明らか に する きっかけ で も あり ます せっかく 辛い 思い を し た の です から この 経験 を 生かし て スキルアップ すれ ば あれ は とても 貴重 な 経験 だっ た と 振り返る こと が できる 日 が きっと くる はず です 
__label__negative, ポジティブ な 感情 と ネガティブ な 感情 の 比率 は 対 ぐらい が いい と いわ れ て いる ネガティブ 感情 に も 生産 的 な もの と 破壊 的 な もの が ある 生産 的 な もの たとえば 怒り や 対立 は 人生 を 繁栄 さ せ たり 成功 さ せる うえ で プラス に なる こと も 多い ので 主 に 減らし たい の は 破壊 的 な もの だ たとえば 嫌悪 侮蔑 など 部下 に も ひとつ 怒っ たら つ ぐらい 褒め た ほう が いい 
__label__negative, ストレス を 受ける と なぜ 人 は マイナス の 感情 を 抱い て しまう の でしょ う か じつは 太古 の 昔 人 が 生きる 目的 の すべて が 生き残っ て 子孫 を 残す こと だっ た ころ 感情 は 生き残る ため の 手段 の 一つ でし た たとえば 敵 に 攻撃 さ れ た とき に 反撃 する ため に は 怒り が 必要 でし た 巨大 な マンモス から 逃げる ため に は 恐怖 の 感情 が 必要 でし た し 危険 な 行動 を あきらめる ため に は 落ち込み の 感情 が 必要 でし た そうして 発達 し た 感情 が 文明 が 発達 し た 現代 で も 本質的 に 古代 の まま 受け つが れ て いる の です 
__label__negative, ネガティブ な 感情 の せい で 仕事 が うまく いか なく なっ て しまう 人 と むしろ パフォーマンス を 高める きっかけ に できる 人 と が いる の は 事実 です その 差 は どこ に ある の でしょ う か うまく いか ない 人 は 不安 に なっ て は いけ ない 迷っ て い て は いけ ない ネガティブ に なっ て は いけ ない と 感情 を 否定 し ます 一方 うまく いく 人 は 自分 の 感情 を きちんと 受け入れ ます 感情 と は 潜在意識 が 自分 に 伝え て くる メッセージ で ある という こと を 理解 し て いる から です 
__label__negative, ネガティブ に なっ たら 心 の 中 で ストップ 
__label__negative, 現代社会 は いや でも ネガティブ 感情 を 刺激 さ れる こと が 多い その 結果 逆 に 毎日 悪い ところ を 見つける 習慣 を 持っ て しまう と それ こそ 不機嫌 な 人生 に 追い込ま れる 人生 は 怖い 人生 は 失敗 する 人生 は つまらない など と 思い込ま さ れ て いる と し たら ぜひ 毎日 つい い こと や 嬉しかっ た こと を 書き出す 習慣 で 脳 を 書き換える と いい 
__label__negative, 怒り に は ネガティブ な イメージ が あり ます が 貧乏 や 差別 を バネ に し て 社会的 に 成功 し た 人 が たくさん いる よう に 目盛り が 振り切れる ほど の 怒り に は とてつもない 力 が あり ます 
__label__negative, 不安 と は 未来を 否定 的 に 予測 する こと です 不安 に 駆ら れ て いる 人 は まだ 実現 し て い ない こと に対して ネガティブ な 想像 を 膨らま せ て いる 状態 に あり ます これ は 公平 な 見方 と 言える でしょ う か 
__label__negative, ネガティブ な 感情 は 自分 の 課題 を 明らか に する きっかけ で も あり ます せっかく 辛い 思い を し た の です から この 経験 を 生かし て スキルアップ すれ ば あれ は とても 貴重 な 経験 だっ た と 振り返る こと が できる 日 が きっと くる はず です 
__label__negative, 物事 が 成功 する 可能性 に 疑問 や 疑念 を 抱く の は ネガティブ 思考 に 陥っ て いる 証拠 で そうした 考え は 頭から 追い払う べき だ と 言わ れる しか し そういった 発想 は 不健全 で 愚か な もの だ 根拠 の ない 楽観 主義 を かたくな に 持ち 続ける こと は 愚行 以外 の なに もの で も ない 
__label__negative, 口角 を 下げ て しまう と ネガティブ な 顔 に なっ て しまい ます すると 相手 に 不快感 を 与え かね ませ ん 会話 も 弾ま なく なっ て 嫌わ れ て しまう かも しれ ませ ん 
__label__negative, 最近 の テレビ や 新聞 の ニュース を 見 て い ます と ネガティブ な 話 が 多 すぎ ます 経済 関連 に し て も 日本製品 の シェア や 商品開発 が 某国 に 負け て いる あるいは 取り組み が 遅れ て いる など 後ろ向き の 話 ばかり で どうも 今 の 日本 は 元気 が ない もっと 自信 を 持っ て 行動 す べき だ と 思い ます 
__label__negative, 自信 が ない と 自分 に は でき ない ん じゃ ない か など と ネガティブ な こと を 考え て 心 を 乱し がち です でも 客観的 に 見れ ば 十分 な 実力 を 備え て いる こと が 少なく あり ませ ん 
__label__negative, ＳＮＳ の 普及 により ネガティブ な イメージ もより 早く 伝わる よう に なり まし た 炎上 と 言わ れる よう な 現象 も しばしば 発生 し ます これ は 情報 の 受け手 の 立場 に 立っ て 物事 を 考え て い ない から 起こり ます 顧客 に対して 愛 を 持っ て い て 彼ら が 何 を 求め て いる か が わかっ て いれ ば トラブル は 起こり ませ ん し 問題 が 発生 し た として も 真摯 に 説明 を 行え ば 理解 し て もらえる はず いま 一 度 自問 する べき は お客様 へ の 愛情 です それ が あれ ば どんな やり方 で も うまく いく の です 
__label__negative, 男女 の 仲 という の は 夕食 を 二人 っきり で 三 度 し て それ で どうにか なら なかっ た とき は あきらめろ 
__label__negative, 歳 より 前 に 悲観主義 者 に なる 者 は 物事 を 知り すぎ 歳 を 越え て も なお 楽観 主義者 である 者 は 物事 を 知ら な すぎる 
__label__negative, 楽観 主義者 は 青信号 しか 見え ない 悲観主義 者 で は 赤信号 しか 見え ない そして 真 の 賢者 と は 色盲 で ある 
__label__negative, まだ 起き て も い ない 事柄 について マイナス の 思考 を する の は 完全 に 間違っ て い ます 
__label__negative, 悲観的 に なっ たら 薔薇 を 眺めよ 
__label__negative, 悲観論 者 と は 何 か すべて の 人 が 自分 の よう に 胸くそ が 悪く そのため に 彼ら を 憎む もの だ 
__label__negative, 日本人 は 批判 さ れる こと を ネガティブ に 捉える 傾向 が ある 日本人 は 本音 を グサリ と 言わ れる こと が 好き で は ない よう に 思え た 
__label__negative, 韓国 は 賑やか な のに 日本人 の 顔 は 冴え ない し 節電 で 暗く て ネガティブ 
__label__negative, 絶望 が 純粋 な の は たった 一つ の 場合 だけ で ある それ は 死刑 の 宣告 を 受け た とき で ある 
__label__negative, 夜 は われ の 友 われ の 指導者 は 絶望 なり き 
__label__negative, 人間 に 死 の ある こと が そもそも の 絶望 の 本質 で ある 
__label__negative, 絶望 と は 死にいたる病 で ある 自己 の 内 なる この 病 は 永遠 に 死ぬ こと で あり 死ぬ べく し て 死ね ない こと で ある それ は 死 を 死ぬ こと で ある 
__label__negative, 富 を 軽蔑 する という 人間 を あまり 信じる な 富 を 得る こと に 絶望 し た 者 が 富 を 軽蔑 する の だ そして こういう 人間 が たまたま 富 を 得る と 何 より も 始末 が 悪い 
__label__negative, 落胆 は 絶望 の 母 
__label__negative, いくら 優れ た 能力 が あっ て も 周囲 に ネガティブ な パワー を 送る 人 は その 能力 を 生かす 場 が あり ませ ん 
__label__negative, 絶望 と は 愚者 の 結論 で ある 
__label__negative, 大 多数 の 人間 は 静か な 絶望 の 生活 を 送っ て いる 
__label__negative, 幸せになろう と 思わ ない で ください 幸せ を つかみ に 行っ て 幸せ を つかん だ 人 は ひとり も い ませ ん 幸せ は 感じる もの です 
__label__negative, 人 の 生き方 に 反対 で も 変え させる の は 良く ない わ それに 大抵 手遅れ だ し 
__label__negative, 人生 の 半分 は トラブル で あと の 半分 は それ を 乗り越える ため に ある 
__label__negative, 意味 が 見つから ない から 良き 人生 を 送れ ない の で は なく 良き 人生 を 送れ ない から こそ 意味 に すがる の だ 
__label__negative, 威圧 系 笑わ ない それ で いい や それ が 私 の 武器 
__label__negative, 人生 は すべて 次 の ふたつ から 成り立っ て いる し たい けど でき ない できる けれど し たく ない 
__label__negative, 最悪 の まんま 生きよう 
__label__negative, 判断力 を なくし て 結婚 し 忍耐 力 を なくし て 離婚 し そして 記憶力 を なくし て 再婚 する 
__label__negative, みんな スカスカ の 人生 な のに 幸せ そう な フリ を し て いる だけ な ん だ よ 
__label__negative, とにかく ね 生き て いる の だ から インチキ を やっ て いる の に 違い ない の さ 
__label__negative, いま の 世の中 で 一 ばん 美しい の は 犠牲者 です 
__label__negative, 幸福 の 便り という もの は 待っ て いる 時 に は 決して 来 ない もの だ 
__label__negative, 学問 と は 虚栄 の 別名 で ある 人間 が 人間 で なく なろ う と する 努力 で ある 
__label__negative, 生き て いる 事 ああ それ は 何 という やりきれない 息 も たえだえ の 大 事業 で あろ う か 
__label__negative, バルザック の 散歩 用 の 杖 に は 『 私 は あらゆる 困難 を 打ち砕く 』 と 刻ま れ て い た そうだ 僕 の 杖 に は 『 あらゆる 困難 が 僕 を 打ち砕く 』 と 刻ま れ て いる 
__label__negative, すべて お 終 い の よう に 見える とき でも まだまだ 新しい カ が 湧き出 て くる それ こそ おまえ が 生き て いる 証 な の だ もし そういう カ が 湧い て こ ない なら その とき は すべて お 終 い だ もう これ まで 
__label__negative, ぼく は 現代 の ネガティブ な 面 を 堀 り あ て それ を 身 に つけ て しまっ た の で ある ポジティブ な もの は ほんの わずか で さえ 身 に つけ なかっ た ネガティブ な もの も ポジティブ と 紙一重 の 底 の 浅い もの は 身 に つけ なかっ た どんな 宗教 によって も 救わ れる こと は なかっ た ぼく は 終末 で ある それとも 始まり で あろ う か 
__label__negative, ぼく は 人生 に 必要 な 能力 を なに ひとつ 備え て おら ず ただ 人間 的 な 弱み しか 持っ て い ない 
__label__negative, 将来 に むかっ て 歩く こと は ぼく に は でき ませ ん 将来 に むかっ て つまずく こと これ は でき ます いちばん うまく できる の は 倒れ た まま で いる こと です 
__label__negative, 親子 関係 は 病 で あり 治癒 は 不可能 だ と もう あきらめ て 誰 も が 粛々と この 病原菌 に 感染 し て あと は じわじわ と 進行 し 症状 が 重く なる の を 受け入れ ながら 一生 が 終わる の を 待つ しか ない 
__label__negative, 日本人 は 絶望 を 知ら ない 絶望 する 前 に 諦め て しまう 
__label__negative, 死 の 存在 と は あるいは 我々 に 自発 的 に 人生 を 断念 さ せ あるいは 死 が 奪う こと の 出来 ない 意味 を 人生 に 与える こと によって 我々 の 人生 を 変容 せしめる の だ 
__label__negative, すべて の 家庭 人 は 人生 の 半ば を あきらめ て 居る 
__label__negative, 不幸 に対する 特効薬 など ない ただ 昔 から 退屈 な 忍耐 とか 諦め とかいう 美徳 が ある のみ だ 
